	Unnamed: 0	sentence_A	sentence_B	label	idx
240	240	Robert Erwin, president of Biosource, called Plant Genetic's approach ``interesting'' and ``novel,'' and ``complementary rather than competitive.'' ``There is a large market out there hungry for hybrid seeds,'' he said. Mr. Robinson of Delta & Pine, the seed producer in Scott, Miss., said Plant Genetic's success in creating genetically engineered male steriles doesn't automatically mean it would be simple to create hybrids in all crops.	it would be simple to create hybrids in all crops	contradiction	240
187	187	B: Uh, with regard uh, to jury trials. I really feel as though, uh, uh, whatever system has been used historically, in particular jurisdiction, you know, is really the only kinds of things that you can use. Because the jurisprudence is, you know, based uh, you know, on accumulated body of law. And if you have a situation where you change that body of law, then all of sudden they could start going back and digging up all these cases uh, that would be handled differently were they judged by today's standards. So I really don't think they can really do much of anything to change it.	they can really do something to change it	contradiction	187
202	202	B: And as far as like them, uh, entertaining the rights that they should have. A: Uh-huh. B: I mean, we educate them, we feed them, we take care of them and they no sooner get out on the street and they're back in again. A: Uh-huh. B: I'm not saying they're all bad,	they're all bad	contradiction	202
236	236	A: Yeah, I think that's what aggravates a lot of people, is somebody does get a life sentence in place of the death penalty, and they wind up back on the streets after five years or six years or like the kid on the news tonight out in Mesquite who was out in six months.. B: Uh-huh. Yeah, it's just our criminal system is just so, I guess, overloaded, but the problem is not so much with the prison system, you know, I mean, because the cops are out there doing their job enforcing the laws, and the prison system are just, you know, they're trying to cope with them, but, you know, the thing about capital punishment I, you know, a lot of people don't think it would be a deterrent, uh, to future crime,	capital punishment would be a deterrent to future crimes	contradiction	236
185	185	B: I think the, uh, I think a lot of the commentators on, like the major networks, like right, it's kind of appropriate right now because of the election stuff going on, but, um, it seems that, um, they kind of get to throw their opinions into how they, you know, report on the news. A: Right. And I think even in the elections, they choose who they're going to follow and who they're not, and basically you know, if a candidate can get them to follow, then the news will, you know, kind of publicize his name. B: Yeah.  Yeah, exactly. A: I don't think that the way I get the news is the right way to get it.	the way she gets the news is the right way to get it	contradiction	185
44	44	Nevertheless, her heart sank at the thought of spending an evening with him in his present state of mind, and she was tempted to invent a sore throat in order to get out of it. But he had been very helpful over the Puddephat business, she admitted to herself, and his moods were unpredictable - he might be on top of the world by the time he arrived at the cinema. ``I'm still keen if you are '' she said brightly pretending she had not noticed anything was amiss.	something was amiss	entailment	44
215	215	A: I thought Carter was good too, and that was, yeah, B: Did you? I always liked him, I thought he was great at the time and I just couldn't get over the fact that Reagan beat him. you know, that I just couldn't believe that he got voted out.	Carter got voted out	entailment	215
225	225	A: No, not really. I spends a lot of time with our income tax, though. especially, this year and last year. Um, I have been married for just a few years, so I've had to really switch around from the EZ form to the, uh, B: Schedule A. A: Right. B: Well, yeah. A: All the deductions and all that. B: Did you notice that when they passed the new simplified tax act, it seemed like it made everything harder?	when they passed the new simplified tax act  it seemed like it made everything harder	entailment	225
81	81	At this time of year not much, it's been a dryish summer, and there's not a lot of water coming down. Say half a knot - and that's probably an over-estimate. If you say that a freely-floating body - and the weights would help a bit there because they'd keep it under water and out of any wind - moves down on the ebb at an average of a bit under two knots you'd not be far wrong.	a freely-floating body moves down on the ebb at an average of a bit under two knots	entailment	81
0	0	It was a complex language. Not written down but handed down. One might say it was peeled down.	the language was peeled down	entailment	0
34	34	Jane ate without pausing. Hunger was an unknown experience. She had never imagined it could actually hurt.	hunger could actually hurt	entailment	34
197	197	A: Oh, wow! But maybe you shouldn't be held responsible for something you did several years ago. B: So,  I know. A: That's the other thing. I mean a lot of people as kids or, you know, young people get into some things that they get out of later on and I don't think they should really have to pay for that forever.	they should really have to pay for that forever	contradiction	197
123	123	B: And I don't think that rehabilitation is effective. A: Right. Have to agree with you, and I'm kind of in favor of capital punishment also. I just don't think that it acts much as a deterrent to these people because, uh, you still see them committing the same crimes,	it acts much as a deterrent to these people	contradiction	123
147	147	B: I wouldn't be surprised. A: You know, because they don't want to send them to daycare. B: I doubt if they would say it was too long.	it was too long	contradiction	147
26	26	I should dearly have liked to know whether they were Europeans or Americans, but I couldn't hear the accents. They appeared to be arguing. I hoped the white men weren't telling him to eliminate all witnesses because I don't believe it would have needed much persuasion.	eliminating all witnesses would have needed much persuasion	contradiction	26
198	198	B: Uh, I have, uh, I guess a lot of thoughts about the Vietnam War, um, I guess I feel like I was pretty young while it was going on and so there's probably a lot of things I remember and a lot of things that I really didn't have a clue as to what was happening. B: Yeah. A: Um, looking back, like maybe some of the things that I know now, I'm not sure I do believe it was worth the cost in dollars and lives. That was one of the questions that she asked us to think about, because we never went to war. I don't think we were committed to winning it and getting out	they were committed to winning the Vietnam War and getting out	contradiction	198
196	196	B: And they go down the line ten years and then on some little technicality they get out and on the streets again doing the same they did before. A: Uh-huh. B: And, you know, that's about the only thing. Like for theft and stuff like that or manslaughter, you know, I don't think they should do that.	they should do that	contradiction	196
176	176	B: Uh, uh, I've had one or two American cars I think, and they were okay. I had a Pontiac once and I never had a problem with it, but, uh, my mother had a Dodge at one point and I had driven it a few times and I really did not feel that I would buy a Dodge just from, A: Um. B: well, actually, I had uh, a Dodge Omni at one point A: Uh-huh. B: and that was, I think, what really prejudiced me against American cars because I did not feel that it was a very quality, uh, car.	the Dodge Omni was a very quality car	contradiction	176
99	99	Meh ' Lindi did not develop the lower set of arms nor the bony, sinuous tail. Too much to expect a new pair of arms to grow out of her ribs, or her coccyx to elongate so enormously. Nor could Jaq imagine that she could attain the full strength of a purestrain Stealer - though her own strength was formidable even when unenhanced.	Meh ' Lindi could attain the full strength of a purestrain Stealer	contradiction	99
38	38	And what she had said, and went on saying quietly, calmly, efficiently, was that she loved Maggie. She paid attention. At eight Maggie had not known that her grandmother was famous but she had seen that people had something in their manner when they looked at Rachel.	Maggie's grandmother was famous	entailment	38
194	194	B: And, uh, I think they've all developed kind of an interest in reading also. A: That's re-, yeah. B: I'm not saying they read all the right things	they read all the right things	contradiction	194
21	21	It seemed impossible that anyone could endure such pain for so long, but at last the doors of the Renault slammed and there was comparative silence. The engine was started up, revving violently as the car was turned round on the narrow road. John could tell that it was being driven back up the hill towards Putna.	the car was being driven back up the hill towards Putna	entailment	21
76	76	``Clever''. Klug means ``clever''. Would you say that Abie was clever?	Abie was clever	neutral	76
228	228	B: so there's only been really one working. A: Uh-huh, same here. Uh-huh. B: And, uh, it works for me but I can't see that it would work for probably the majority of people.	it would work for probably the majority of people	contradiction	228
