	Unnamed: 0	sentence_A	sentence_B	label	idx
140	140	A:  nanny, sort of? Uh-huh. Uh-huh. B: and you know, I could envision a society where that would happen and make an interesting, uh, uh, story or whatever. A: Yeah. B: I don't think I have a philosophical problem with that.	she has a philosophical problem with that	contradiction	140
36	36	``You don't need to worry. We're quite adequately chaperoned. Rosa is a woman of strict moral principles.'' If she knows I'm in here she's probably hovering outside the door right now.	he's in here	entailment	36
229	229	B: Well, that's kind of the way I feel about rock and roll sometimes, too, I guess. They don't really, has kind of the same sound over and over, and the other thing I don't like about it is they have a tendency to play the instrumental so loud that you can't understand what the lyrics are A: Um. Right. B: you can't understand what they're saying on some of those songs which probably is just as well on some of them, too. A: Yeah. And I can't say that I like a lot of the very modern, uh, rock and roll,	she likes a lot of the very modern rock and roll	contradiction	229
249	249	Under the Racketeer Influenced and Corrupt Organizations law, or RICO, the government has the authority to seek to freeze or seize a defendant's assets before trial.  According to individuals familiar with Mr. Antar's case, prosecutors issued their warning this week after one of Mr. Antar's attorneys asked whether legal fees might be subject to seizure. In a letter, prosecutors told Mr. Antar's lawyers that because of the recent Supreme Court rulings, they could expect that any fees collected from Mr. Antar may be seized.	any fees collected from Mr. Antar may be seized	entailment	249
242	242	The trend toward lower rents may seem surprising given that some communities in New York are bemoaning the loss of favorite local businesses to high rents.  But, despite the recent softening, for many of these retailers there's still been too big a jump from the rental rates of the late 1970s, when their leases were signed. Certainly, the recent drop in prices doesn't mean Manhattan comes cheap.	Manhattan comes cheap	contradiction	242
109	109	And I was excited by my new importance. Proud and pleased to be playing opposite Frank Donovan who had once stood in for Hayden Coffin. Occasionally perhaps I should notice that he was not the jovial easy-going character I remembered from my humble place in the chorus.	Frank Donovan was not the jovial easy-going character she remembered	entailment	109
14	14	And why bother to write anyway? What was there to say? Mary had some vague idea that Adam's parents might suspect he was down here and come to see him.	Adam was down here	entailment	14
71	71	``I wanted to tell you. But the Bookman asked me to keep our meeting a secret.'' How did you know I 'd met him?	he had met the Bookman	entailment	71
144	144	A: I am right outside Baltimore. I am less than a mile from the Baltimore line. B: Um. A: And I go to a campus of the University of Maryland that is just, less than a mile from my house. So I'm actually in Baltimore, yeah, you could say I'm in Baltimore.	he is in Baltimore	entailment	144
43	43	``Oh, my poor Folly... We 've been together for five years, Lexy and I - she practically holds that company together. Of course I gave her an ``A''. But that doesn't mean I'm having an affair with her.	he is having an affair with Lexy	contradiction	43
16	16	She said good morning to Alice and Alice said hallo. She was thin and rather tall with a very lined gentle face and hair that was white but which Alice could see had once been blonde. She could also have told this was Tina's mother before Mrs Darne went off down the passage that led to the Headmaster's Flat.	this was Tina's mother	entailment	16
116	116	Paula could not help herself. It was just the way she was. Others might say they hated her and mean it.	others hated Paula	entailment	116
17	17	She might have sat all afternoon, nibbling and stuporous, exhausted but not sleepy. But the glazier finally came down from the upper floor, cheerfully announcing that all was now right and tight and he would be on his way. Maggie could tell that he would have liked to stop for a chat that he felt sorry for her left on her own but she lacked either her grandmother's grace or her mother's energy so she did not offer him tea.	the glazier would have liked to stop for a chat	entailment	17
156	156	A: That's fairly interesting. B: I bet that would be, rather interesting. Uh, that's, uh, self improvement, well, that's kind of a hobby but it is self improvement from the standpoint of probably relaxing, uh. A: Yeah, I don't know that I read anything strictly labeled self improvement.	she reads anything strictly labeled self improvement	contradiction	156
219	219	B: Uh-huh. So, yeah, that's the thing is just to look at the school system in the area that you move into before you. A: Uh-huh. Of course we have a slight problem in that, uh, the number of the illiterate in America is mushrooming at this point, and, uh, you know, where our kids might be in a great school, we're still paying an awful lot of taxes for people who are on welfare and unemployment because they can't read, you know. B: Uh-huh. A: So. B: But do you think that there should be, um, nationwide, um, curriculum?	there should be a nationwide curriculum	neutral	219
4	4	Some of them, like for instance the farm in Connecticut, are quite small. If I like a place I buy it. I guess you could say it's a hobby.	buying places is a hobby	entailment	4
58	58	But he ended up eating it himself. I was reluctant to kiss my mother, afraid that somehow her weakness and unhappiness would infect me. Naturally I didn't think for a minute that my life and spirit could stimulate her.	her life and spirit could stimulate her mother	contradiction	58
5	5	Look, my dear, I'm not in my dotage yet, and I know I'm a grumbler and a complainer. You could say the only form of comfort I 've got are my complaints.	the only form of comfort he has are his complaints	entailment	5
142	142	A: so it's nice to get away. It's just amazing, how much you miss. B: Yeah, it,  Yeah, it, yeah, it really is. I mean, I don't think I ever see the Little Dipper,	she has seen the Little Dipper	contradiction	142
18	18	Jim waited. He waited a long time, and when the young doctor finally came out, it was almost dark. Jim could nonetheless tell by his anxious face that something was wrong.	something was wrong	entailment	18
30	30	Yet what good came from knowing that a woman had killed herself? The children who had suffered a trauma would survive the experience, scarred by it and a little flawed by it. They would never forget that for a week they had imagined the act of murder had been committed.	for a week the children had imagined the act of murder had been committed	entailment	30
32	32	His mother driving the car, so happy, young-looking and fashionably dressed and his father, a big, confident man in a smart suit, smiling and turning round to say something to Simon in the back seat. Marie thought of her own mother with her frumpy clothes and ageing, lined face. No one would have guessed that she was only forty-two.	Marie's mother was only forty-two	entailment	32
8	8	Like now. The Community in Knockglen would defend Eve vociferously. Even some of the Sisters here in Dublin might see that the girl had a point.	the girl had a point	entailment	8
164	164	B: All right, well. A: Um, short term, I don't think anything's going to be done about it or probably should be done about it.	something's going to be done about it	contradiction	164
208	208	A: but, it was interesting to, I don't know if they're making them better or not, it's hard to say. I think they more of their parts plastic, which, you know, makes things break easier, but I think the technology is better. B: I think technology is better, I'm not sure. I think you've got a good point with the plastic and that. A: About quality. B: I don't think necessarily that, things are being made better uh, you know,	things are being made better	contradiction	208
217	217	A: Uh, I saw Seven Eleven that was hiring. B: Well, I'm sure with the new, uh, contract awarding I think it went to Lockheed, didn't it?	the contract went to Lockheed	entailment	217
60	60	I'm sorry, I 've put you in an invidious position. If you're being run by Morton, he 'll want to hear all this. It won't do any harm but I 'd rather not give him food for thought because I consider him an idiot and I don't think he's capable of interpreting it correctly.	Morton is capable of interpreting this food for thought correctly	contradiction	60
85	85	Your honesty shines out of your face, my darling. It isn't your fault that cynical men like myself won't let themselves believe what they see! I just wish you could believe that Eddie's death was an accident and nothing to do with me.	Eddie's death was an accident and nothing to do with him	entailment	85
63	63	It's where the bands practise. I can't remember what band Petra's in, but I seen them practise once. They were OK but I didn't think they was brilliant.	Petra's band was brilliant	contradiction	63
151	151	A: Well, presumably those who find out such information, if they are doing it, I would prefer to not to be known, and, I mean, you know, the classic, oh, I don't know C I  conspiracy theories or whatever, would have such parties trying to do it without your knowledge. So there's,, things that invade that second type of privacy where you do know about them and possibly things that invade that second type of privacy without you knowing about it, and I can't talk about the second one other than to generate paranoia. It's a surmise and, I'd like to think that it's quite low, at least in this country. B: to surmise. It is there. A: I don't think I'd like the KGB monitoring my phone or anything like that.	he would like the KGB monitoring his phone	contradiction	151
224	224	A: Yeah. The radio doesn't really have much news sometimes. The stations I listen to are just mainly music. B: Yeah, I think you pretty much have to listen to all news station to get any news at all. A: Yeah. Do you think that TV is, uh, pretty accurate.	TV is pretty accurate	neutral	224
84	84	Nicky approached her with the assumption that men are naturally right and it is the role of women to follow their lead. Constance, whose confidence was growing daily, was not prepared to give in to Nicky's wishes merely because of his sex. If she felt he was right then she agreed with him.	Nicky was right	neutral	84
13	13	It was Alan's idea. He made a sour kind of joke out of it, that they must wait until their wedding night. Carolyn agreed because she could see he meant it although she didn't understand why.	Alan meant it	entailment	13
74	74	Anna looked at Peter again and said to herself in a guilty whisper, ``Will he become even more difficult?'' She wondered if a stranger could tell that he was difficult, just by looking at him. Would such a person watching Peter now reading the prayers of Rite B in his level pleasant voice notice that resentment lay like his blood just under his skin because the life he had chosen had not turned out as he had expected it to?	resentment lay just under Peter's skin	entailment	74
100	100	Gloria remarked as they shared their coffee break in the kitchen. Melissa suppressed a sigh. She had hoped to dodge the subject but might have known that Gloria's boundless interest in all things morbid and sensational would make it impossible.	Gloria's boundless interest in all things morbid and sensational would make dodging the subject impossible	entailment	100
93	93	O listened. As he listened he could smell the man. And he could hear that the song was almost turning into a sob.	the song was almost turning into a sob	entailment	93
158	158	A: But, uh, B: Okay.  Uh, uh, I've had one or two American cars I think, and they were okay. I had a Pontiac once and I never had a problem with it, but, uh, my mother had a Dodge at one point and I had driven it a few times and I really did not feel that I would buy a Dodge just from,	she would buy a Dodge	contradiction	158
222	222	B: when you've lost something or uh, uh, don't have what other people have that's when you tend to realize, you know, what's out there and you know, what you have and what you don't have. A: Yeah I agree. B: So the original question, do we think they're you know, a security threat?	they're a security threat	neutral	222
161	161	A: It's divided, yeah. B: Wow! A: It really is, so we've got our Cowboys here and, uh, I don't think anybody roots differently	somebody roots differently	contradiction	161
69	69	I ducked so fast I wasn't sure whether he 'd seen me or not, but it gave me a prickly feeling just to imagine it, so I scuttled for the door and legged it up the spiral stairway three steps at a time, just in case. As I ran, I remember thinking stupid thoughts like. How did he know I was up here looking down?	he was up there looking down	entailment	69
171	171	B: And, you know, the whole electronic classroom idea. I don't know if I I'm yeah, in favor of, yeah, A: I don't think that's going to work.	that is going to work	contradiction	171
206	206	A: I do too. I believe about ten years ago that we went through a terrible time, but I don't, I believe that they're better now, you know, wh-, B: I think so. I don't think they're shoddy	they're shoddy	contradiction	206
139	139	A: And, uh, I got to stay home with my kids, which I really wanted to do, but now I could not go back and do it. B: Yeah. A: I really couldn't, I don't think I could stay home all the time and do nothing.	he could stay home all the time and do nothing	contradiction	139
152	152	B: That might be kind of tough, huh. A: It really would, yes, yes, and like I said, my sister's still in it, and I really don't think my mother'd want to be there, either.	his mother would want to be there	contradiction	152
136	136	B: Yeah, and the ground will filter some of it but not all of it. A: No, not when you figure, I didn't realize one cow produces that much manure	one cow produces that much manure	entailment	136
175	175	A: I spend a lot of time reading about these things. I'm quite interested. I find it very exciting for the coverage we have now, today. B: Yes and I think we do get pretty good coverage. I don't feel that the American people is being shortchanged by uh, the news coverage.	the American people are being shortchanged by the news coverage	contradiction	175
55	55	Only she herself knew the evil thoughts she had and how effortlessly they could be translated into action. ``I 'll make a cup of tea.'' No she would not tell Peter that the person he loved most in the world was dead.	the person Peter loved most in the world was dead	entailment	55
160	160	B: I understand we are doing care of the elderly, right? A: Yes. B: And how do you feel about putting someone in the nursing home? A: Well, I don't think that uh, any of my relatives would really like to go there.	some of her relatives would really like to go there	contradiction	160
174	174	B: I think in s-, and it, just would depend upon the circumstances and the extent of the abuse and if another alternative was available. A: Uh-huh.  Uh-huh.  Um.  Uh-huh. You know, now, I wonder what you think about this and, uh, unfortunately, we don't get to do it, but, uh, it used to be a long time ago, I guess in Biblical times when they had punishment, if somebody did something, for example, to your family, then you had the right to administer the punishment. So if somebody killed somebody in your family, then uh, if that person was caught and found guilty, you had the right to, uh, execute that person. And I know that, uh, if somebody had done something to my family, I would feel that I had the right to get revenge on them uh, but, I don't think that's done much anywhere.	that's done much anywhere	contradiction	174
7	7	But, of course, that just wasn't possible. Her disappointment over Jonathan, which had driven her to France in the first place, had been relegated somewhere to the back of her mind. Now in retrospect she could see that marriage to him would have been a ghastly mistake and that her reaction to discovering that he had been seeing other women while he had been engaged to her had had far more to do with wounded pride than with a wounded heart.	marriage to Jonathan would have been a ghastly mistake	entailment	7
