	Unnamed: 0	sentence_A	sentence_B	label	idx
163	163	A: Have you followed that very much or, B: Uh, not really. I don't think anything will ever take over the NFL.	something will take over the NFL	contradiction	163
69	69	I ducked so fast I wasn't sure whether he 'd seen me or not, but it gave me a prickly feeling just to imagine it, so I scuttled for the door and legged it up the spiral stairway three steps at a time, just in case. As I ran, I remember thinking stupid thoughts like. How did he know I was up here looking down?	he was up there looking down	entailment	69
197	197	A: Oh, wow! But maybe you shouldn't be held responsible for something you did several years ago. B: So,  I know. A: That's the other thing. I mean a lot of people as kids or, you know, young people get into some things that they get out of later on and I don't think they should really have to pay for that forever.	they should really have to pay for that forever	contradiction	197
158	158	A: But, uh, B: Okay.  Uh, uh, I've had one or two American cars I think, and they were okay. I had a Pontiac once and I never had a problem with it, but, uh, my mother had a Dodge at one point and I had driven it a few times and I really did not feel that I would buy a Dodge just from,	she would buy a Dodge	contradiction	158
42	42	He said that maybe I wasn't ready to join the Party just yet. Terry's passion for equality appealed to my purer mind, and his hatred of existing authority appealed to my resentments. But although I hated inequality it didn't mean I wanted to be treated like everyone else.	he wanted to be treated like everyone else	contradiction	42
35	35	Miss Martindale had had a school, but her rigid ideas and stern manner had frightened the children, and their parents had taken them away. And gradually the school declined, until she had to give it up and retire to end her days in the white cottage with the inevitable cat as her only companion. Breeze had never imagined that digging was such hard work.	digging was such hard work	entailment	35
143	143	B: Yeah. It's, uh, I have modem night computer so I can log into the, uh, network at Georgia Tech and access my account through there, which can be useful. But, uh, yeah that and word processing is while I tend to, I mean, obviously, I do almost all of my report writing on my computer, uh, whether it's term papers or even some smaller homework assignments. A: Uh-huh. B: So it's I don't know, really become my mainstay I guess. I can't even remember, actually I don't think I've ever used a typewriter in my life to do a report. Because my family, when I was growing up, we got a basic computer. TRS Eighty when they first came out.	he has used a typewriter to do a report	contradiction	143
190	190	B: The kind you have sounds very interesting, though. A: Well, um, they're really sweet dogs. uh, we thought probably our neighborhood in Houston had more of this breed than any other place just because of, um, the family that had them and bred them.	their neighborhood in Houston had more of this breed than any other place because of the family that had them and bred them	entailment	190
39	39	They 'd seen Miss Lavant on the promenade and about the town, always walking slowly, sometimes with a neat wicker basket. Kate had often thought she was beautiful. She hadn't known she was in love with Dr Greenslade who had a wife already and three children.	Miss Lavant was in love with Dr Greenslade	entailment	39
209	209	A: It was just a side benefit. B: Yeah, yeah, because, I'm not big or anything, but I'm not in great shape, But when I worked out, I got in pretty good shape. I didn't build up muscle, though, I just got real good and toned. A: Yeah. B: I don't think women look good with muscles.	women look good with muscles	contradiction	209
157	157	A: They might be, but not at the human factors level. they're, B: Well, I heard it on the news today, I could swear it was IBM.	it was IBM	entailment	157
222	222	B: when you've lost something or uh, uh, don't have what other people have that's when you tend to realize, you know, what's out there and you know, what you have and what you don't have. A: Yeah I agree. B: So the original question, do we think they're you know, a security threat?	they're a security threat	neutral	222
40	40	Did he intend everyone in the castle to know he did not want the wife he had married in such a hurry? Did he intend to ignore her completely? Then Isabel saw Ellen's stunned face and realised that her maid at least did not know she had spent the night alone.	Isabel had spent the night alone	entailment	40
176	176	B: Uh, uh, I've had one or two American cars I think, and they were okay. I had a Pontiac once and I never had a problem with it, but, uh, my mother had a Dodge at one point and I had driven it a few times and I really did not feel that I would buy a Dodge just from, A: Um. B: well, actually, I had uh, a Dodge Omni at one point A: Uh-huh. B: and that was, I think, what really prejudiced me against American cars because I did not feel that it was a very quality, uh, car.	the Dodge Omni was a very quality car	contradiction	176
213	213	A: Um, yeah, I guess that's not an easy solution. there's no easy solution for that. B: Uh-huh.  I don't know that there is an easy solution, but if you could find a way to prevent some of it, and I'm not sure what it would be. It would be money better spent than, A: Uh-huh. B: do you know it costs more to keep an inmate on death row than it does to send a kid to Harvard?	it costs more to keep an inmate on death row that it does to send a kid of Harvard	entailment	213
185	185	B: I think the, uh, I think a lot of the commentators on, like the major networks, like right, it's kind of appropriate right now because of the election stuff going on, but, um, it seems that, um, they kind of get to throw their opinions into how they, you know, report on the news. A: Right. And I think even in the elections, they choose who they're going to follow and who they're not, and basically you know, if a candidate can get them to follow, then the news will, you know, kind of publicize his name. B: Yeah.  Yeah, exactly. A: I don't think that the way I get the news is the right way to get it.	the way she gets the news is the right way to get it	contradiction	185
36	36	``You don't need to worry. We're quite adequately chaperoned. Rosa is a woman of strict moral principles.'' If she knows I'm in here she's probably hovering outside the door right now.	he's in here	entailment	36
124	124	A: so you hear so much, you get a little tired of it, but then again, so many people you got to understand only catch it once a day, maybe B: Yep. A: but I think the quality of uh, our news is just, uh, I don't believe it could be better	it could be better	contradiction	124
104	104	``For such a person, finding a protector might not be so difficult, even in Edinburgh.'' Jean smiled. He might have known that even someone as sensible as Miss van Wiliamsburgh would try to make a play of this sort.	even someone as sensible as Miss van Williamsburgh would try to make a play of this sort	entailment	104
101	101	Merrill dropped into her chair. That altercation with Luke had drained her. She might have known that he would never divulge his relationship with Elise.	Luke would never divulge his relationship with Elise	entailment	101
144	144	A: I am right outside Baltimore. I am less than a mile from the Baltimore line. B: Um. A: And I go to a campus of the University of Maryland that is just, less than a mile from my house. So I'm actually in Baltimore, yeah, you could say I'm in Baltimore.	he is in Baltimore	entailment	144
186	186	B: Well, you've got, well, any of the big cities you've got the different rival gangs and they're having their little turf wars over their little drug kingdoms and such, A: Uh-huh. B: And they get out their little Mac tens, they get out their little uzis and they're going to fight with them. And it doesn't matter what restrictions you put on that type of weapon or a class three firearm. If they want it they'll get it. I don't care if they've got to go down into New Mexico to get it they'll get it and they'll get across the border. Now my position, although, I have absolutely no use for a fully automatic weapon, anyway. A: Uh-huh. B: Since I am a law-abiding citizen and I have never had a felony, if I wanted to buy one, I don't think there should be that big of a restriction on it.	there should be that big of a restriction on it	contradiction	186
242	242	The trend toward lower rents may seem surprising given that some communities in New York are bemoaning the loss of favorite local businesses to high rents.  But, despite the recent softening, for many of these retailers there's still been too big a jump from the rental rates of the late 1970s, when their leases were signed. Certainly, the recent drop in prices doesn't mean Manhattan comes cheap.	Manhattan comes cheap	contradiction	242
94	94	How did Selden know that the hound was following him? We know he ran a long way. He was screaming for a long time before he fell and we could hear that he was running as he screamed.	Selden was running as he screamed	entailment	94
99	99	Meh ' Lindi did not develop the lower set of arms nor the bony, sinuous tail. Too much to expect a new pair of arms to grow out of her ribs, or her coccyx to elongate so enormously. Nor could Jaq imagine that she could attain the full strength of a purestrain Stealer - though her own strength was formidable even when unenhanced.	Meh ' Lindi could attain the full strength of a purestrain Stealer	contradiction	99
32	32	His mother driving the car, so happy, young-looking and fashionably dressed and his father, a big, confident man in a smart suit, smiling and turning round to say something to Simon in the back seat. Marie thought of her own mother with her frumpy clothes and ageing, lined face. No one would have guessed that she was only forty-two.	Marie's mother was only forty-two	entailment	32
208	208	A: but, it was interesting to, I don't know if they're making them better or not, it's hard to say. I think they more of their parts plastic, which, you know, makes things break easier, but I think the technology is better. B: I think technology is better, I'm not sure. I think you've got a good point with the plastic and that. A: About quality. B: I don't think necessarily that, things are being made better uh, you know,	things are being made better	contradiction	208
103	103	I was angry with her for not saying anything, not doing anything. I still had a formless feeling that she understood me where my mother did not. Perhaps it was despair that made me believe there was one person in the world who might know that I was in despair.	he was in despair	entailment	103
236	236	A: Yeah, I think that's what aggravates a lot of people, is somebody does get a life sentence in place of the death penalty, and they wind up back on the streets after five years or six years or like the kid on the news tonight out in Mesquite who was out in six months.. B: Uh-huh. Yeah, it's just our criminal system is just so, I guess, overloaded, but the problem is not so much with the prison system, you know, I mean, because the cops are out there doing their job enforcing the laws, and the prison system are just, you know, they're trying to cope with them, but, you know, the thing about capital punishment I, you know, a lot of people don't think it would be a deterrent, uh, to future crime,	capital punishment would be a deterrent to future crimes	contradiction	236
219	219	B: Uh-huh. So, yeah, that's the thing is just to look at the school system in the area that you move into before you. A: Uh-huh. Of course we have a slight problem in that, uh, the number of the illiterate in America is mushrooming at this point, and, uh, you know, where our kids might be in a great school, we're still paying an awful lot of taxes for people who are on welfare and unemployment because they can't read, you know. B: Uh-huh. A: So. B: But do you think that there should be, um, nationwide, um, curriculum?	there should be a nationwide curriculum	neutral	219
238	238	B: Well, I was never there for any sentencing. Uh, I finally got empaneled on one case, uh, on my next to the last day, and, uh, we got into the, uh, jury room to, uh, decide the case, and there was one guy on the jury who announced to everybody that he didn't need to deliberate, because he'd already decided that the guy was, uh, not guilty, and he would never vote for guilty. A: Huh. B: So, uh, they appointed me jury foreman and I, uh, didn't think that, uh, going in without deliberating allowed us to reach a verdict,	going in without deliberating allowed them to reach a verdict	contradiction	238
53	53	Oh, I did, I did! I was lucky. I would have liked brothers and sisters but I don't remember that I was ever lonely.	she was ever lonely	contradiction	53
75	75	Jean was tough and liked to drink. She would endure for a long while yet. But what would she do when she realized that with things as they were she was on a life sentence not just a temporary suspension of essential pleasure?	Jean was on a life sentence	entailment	75
174	174	B: I think in s-, and it, just would depend upon the circumstances and the extent of the abuse and if another alternative was available. A: Uh-huh.  Uh-huh.  Um.  Uh-huh. You know, now, I wonder what you think about this and, uh, unfortunately, we don't get to do it, but, uh, it used to be a long time ago, I guess in Biblical times when they had punishment, if somebody did something, for example, to your family, then you had the right to administer the punishment. So if somebody killed somebody in your family, then uh, if that person was caught and found guilty, you had the right to, uh, execute that person. And I know that, uh, if somebody had done something to my family, I would feel that I had the right to get revenge on them uh, but, I don't think that's done much anywhere.	that's done much anywhere	contradiction	174
112	112	For a while the notion gripped him, and he prowled the many floors of Hamleys looking for toys. He bought a magic set for Sebastian (although his ideal present for the kid would have been a brand-new name) and a marionette for Louise. He could remember that there was an age for puppets and magic just as he could remember the time that he 'd spent trying to fan a deck of cards or sitting in front of a mirror trying to get the hard consonants down like a real ventriloquist.	there was an age for puppets and magic	entailment	112
91	91	He also liked swimming and cycling. He said that he wrote stories, though he had to admit that he had never got further than the first two pages. Willie meanwhile not only remained silent during these conversations but picked his berries slowly so that they might forget that he was there but he reckoned without Zach.	Willie was there	entailment	91
111	111	When he was there we were Bonnie and Clyde, now he was gone we were Blondie and Dagwood. Or rather, now he was gone, I was Dennis. If I 'd been smarter or less vain I might have realized that this meant that my former role was now vacant.	this meant her former role was now vacant	entailment	111
44	44	Nevertheless, her heart sank at the thought of spending an evening with him in his present state of mind, and she was tempted to invent a sore throat in order to get out of it. But he had been very helpful over the Puddephat business, she admitted to herself, and his moods were unpredictable - he might be on top of the world by the time he arrived at the cinema. ``I'm still keen if you are '' she said brightly pretending she had not noticed anything was amiss.	something was amiss	entailment	44
27	27	But the damage was done as far as my faith was concerned, which is probably why I went mad. So anyway, that Christmas Eve night confirmed my worst fears, it was like a kind of ``royal flush'' for the infant Jimbo. All three kings - Pa Santa and the King of Kings - all down the pan together... And to be honest I don't believe any of them stands a chance of ever making a comeback with me.	any of the three kings stands a chance of ever making a comeback with him	contradiction	27
13	13	It was Alan's idea. He made a sour kind of joke out of it, that they must wait until their wedding night. Carolyn agreed because she could see he meant it although she didn't understand why.	Alan meant it	entailment	13
128	128	B: Uh-huh. It, I mean, I don't know, I don't think George Bush will make the American people happy with ninety-seven cents a week. A: No, no, not at all. B: I just don't think it was a well thought out incentive.	it was a well thought out incentive	contradiction	128
88	88	She longed for a weapon, for even a hairpin, and knowing that she did not have one, she knew too that she was totally defenceless, unarmed and alone. She could feel the great flight of the dragon and sensed that she was high in air and travelling fast towards the sunset. She could feel the great muscles of the dragon's wings send ripplings down the stomach walls and she gave herself over to death.	the great muscles of the dragon's wings sent ripplings down the stomach walls	entailment	88
240	240	Robert Erwin, president of Biosource, called Plant Genetic's approach ``interesting'' and ``novel,'' and ``complementary rather than competitive.'' ``There is a large market out there hungry for hybrid seeds,'' he said. Mr. Robinson of Delta & Pine, the seed producer in Scott, Miss., said Plant Genetic's success in creating genetically engineered male steriles doesn't automatically mean it would be simple to create hybrids in all crops.	it would be simple to create hybrids in all crops	contradiction	240
146	146	A: Do you go to museums in Europe? B: Uh, actually, no, I don't think I went to any of them.	she went to some of them	contradiction	146
62	62	You really don't know anything about me, do you, despite all that wallowing in my mind? As it happens I don't think I'm the right person to lead humanity into the future no.	she is the right person to lead humanity into the future	contradiction	62
216	216	A: Well I, uh, when is your next one, uh, scheduled now. B: Well it's like, the last one was my high school graduation the next one was when I graduated from college, so I guess about two more years. A: Yes, well, and do you think you'll have a baby to take back with you.	speaker B will have a baby to take back with her	neutral	216
