	Unnamed: 0	sentence_A	sentence_B	label	idx
23	23	He's weird enough to have undressed me without thinking, according to some mad notion of the ``proper'' thing to do. Perhaps he thought I couldn't lie in bed with my clothes on.	she couldn't lie in bed with her clothes on	contradiction	23
214	214	B: So am I. A: Are you, B: You know, I think it's kind of coming back around to that, don't you,	it's kind of coming back around to that	entailment	214
134	134	B: Yeah. Well, that's the guy that counts. A: Yes. But, maybe we'll get your guy. B: Oh, I don't think Jim Kelly is about to be swayed away from the Bills any time.	Jim Kelly is about to be swayed away from the Bills any time	contradiction	134
123	123	B: And I don't think that rehabilitation is effective. A: Right. Have to agree with you, and I'm kind of in favor of capital punishment also. I just don't think that it acts much as a deterrent to these people because, uh, you still see them committing the same crimes,	it acts much as a deterrent to these people	contradiction	123
223	223	A: Well, I don't know, uh, I have a hard time getting, uh, people on the telephone. B: Oh really. A: Uh-huh, getting through to anybody. Sometimes I call off and on all day, B: Huh. A: but anyway, uh, I guess we're supposed to be talking about family reunions aren't we.	they're supposed to be talking about family reunions	entailment	223
229	229	B: Well, that's kind of the way I feel about rock and roll sometimes, too, I guess. They don't really, has kind of the same sound over and over, and the other thing I don't like about it is they have a tendency to play the instrumental so loud that you can't understand what the lyrics are A: Um. Right. B: you can't understand what they're saying on some of those songs which probably is just as well on some of them, too. A: Yeah. And I can't say that I like a lot of the very modern, uh, rock and roll,	she likes a lot of the very modern rock and roll	contradiction	229
7	7	But, of course, that just wasn't possible. Her disappointment over Jonathan, which had driven her to France in the first place, had been relegated somewhere to the back of her mind. Now in retrospect she could see that marriage to him would have been a ghastly mistake and that her reaction to discovering that he had been seeing other women while he had been engaged to her had had far more to do with wounded pride than with a wounded heart.	marriage to Jonathan would have been a ghastly mistake	entailment	7
182	182	A: I think so, I think, B: I really do. Oh, yeah, it's going to take, uh, you know, the police, I don't think can do it alone, you know.	the police can do it alone	contradiction	182
16	16	She said good morning to Alice and Alice said hallo. She was thin and rather tall with a very lined gentle face and hair that was white but which Alice could see had once been blonde. She could also have told this was Tina's mother before Mrs Darne went off down the passage that led to the Headmaster's Flat.	this was Tina's mother	entailment	16
192	192	A: it was so fattening. B: That sounds good. A: But, I don't think we gained any weight from it	they gained any weight from it	contradiction	192
80	80	Indeed, in those busy days, our servants ' hall would often witness a gathering of some of the finest professionals in England talking late into the night by the warmth of the fire. Sometimes, naturally, there would be strong disagreements, but more often than not, the atmosphere was dominated by a feeling of mutual respect. Perhaps I will convey a better idea of the tone of those evenings if I say that regular visitors included the likes of Mr Harry Graham valet-butler to Sir James Chambers and Mr John Donalds valet to Mr Sydney Dickenson.	regular visitors included the likes of Mr Harry Graham valet-butler to Sir James Chambers	entailment	80
155	155	B: What am I afraid of? A: Yes. B: Um, I don't know if I'm really afraid of spending too much. I just, uh, don't think that I need them, you know.	she needs them	contradiction	155
227	227	B: What you want. where do they get it?. A: Well, I don't know, I guess they don't have it at home, B: I can't imagine it would stay fresh long enough to,	it would stay fresh long enough	contradiction	227
194	194	B: And, uh, I think they've all developed kind of an interest in reading also. A: That's re-, yeah. B: I'm not saying they read all the right things	they read all the right things	contradiction	194
102	102	``Oh, very well,'' he said wearily. He might have known that it was useless to argue with McAllister - her tongue was as long as her will was strong.	it was useless to argue with McAllister	entailment	102
9	9	``They have to be crushed, Bobkins!'' So saying, she marched off down the gravel path, making the kind of crunching noise Robert had thought could only be produced by the BBC sound-effects department. As they rounded the edge of the building he could see that behind the house was a vast garden.	behind the house was a vast garden	entailment	9
41	41	Most of them young, about his age, stood and talked and drank and laughed. The two girls he had noticed earlier were standing talking to some other girls. Graham hoped they all realised that just because he was standing talking to Slater that didn't mean he was gay too.	Graham was gay too	contradiction	41
160	160	B: I understand we are doing care of the elderly, right? A: Yes. B: And how do you feel about putting someone in the nursing home? A: Well, I don't think that uh, any of my relatives would really like to go there.	some of her relatives would really like to go there	contradiction	160
45	45	What must it be like to be imprisoned here, day after day, month after month? I wonder, does he keep them chained and manacled, thought Fenella, or does he use sorcery? And so utterly immersed was she in this strange blue and green land that was not feeling strange any more that she did not even notice that she was weighing sorcery against steel chains and seriously considering the likely outcome.	Fenella was weighing sorcery against steel chains	entailment	45
96	96	Then it cried. It was another girl. I was a little disappointed but I could only hope that Celia was still a bit hazy from the drugs.	Celia was still a bit hazy from the drugs	neutral	96
230	230	A: so I watch the fish, you know. Whatever I can do to keep myself occupied. I like to have the TV on, because that usually keeps me, um, more occupied. It kind of takes the time away and I don't realize, that's really the only time I ever watch TV, is when I'm on the bike. and then usually after I'm done riding the bike, just to cool myself down, I usually take a walk, you know, and that just kind of uh, gets me, you know, to where I'm not quite as tired I guess. But it's definitely a task. B: You think so? A: I can't say that I really enjoy it.	she really enjoys it	contradiction	230
180	180	B: I think that not only applies inside the public school system, but in society itself. there's been too much negative reinforcement. How much, like, the caught being good slips. How about, just the John Q citizen out there on the street? A: Yeah, well that's true. I think, really though, I mean, that's one thing that, I mean, my kids definitely get spanked when they need to be spanked. But I really do try to use positive, uh, reinforcement with them at home, also. And it really helps. And I mean, they don't get spanked very often, but they do when they deserve it, you know. But, uh, I don't think any kid should be exempt from being spanked. I mean, I think I wouldn't mind if a teacher spanked my child. But, you know, that's just my personal opinion, and that's not going to, I mean, I don't think that law will ever change.	the law will change	contradiction	180
60	60	I'm sorry, I 've put you in an invidious position. If you're being run by Morton, he 'll want to hear all this. It won't do any harm but I 'd rather not give him food for thought because I consider him an idiot and I don't think he's capable of interpreting it correctly.	Morton is capable of interpreting this food for thought correctly	contradiction	60
199	199	B: um, they try to encourage you to follow a specific curriculum, although you don't have to. A: Uh-huh. B: And then if you have particular religious beliefs they're kind of monitored. You know, they will allow you to, I can't think of any examples but certain religious groups don't want their children in public schools because the influence. And maybe they were a group of Mennonites or something like that. A: Uh-huh. B: I don't think they're were in this area	they were in this area	contradiction	199
79	79	She didn't know if they had given themselves sufficient time to think things over before they married - that was the kind of question her sister Louise asked. Edward stayed in the Engineers for a bit, then came out and was not very successful in finding a job to suit him. That wasn't his fault and if anyone said that it was Nenna would still feel like poking a hole in them.	it was Edward's fault	contradiction	79
152	152	B: That might be kind of tough, huh. A: It really would, yes, yes, and like I said, my sister's still in it, and I really don't think my mother'd want to be there, either.	his mother would want to be there	contradiction	152
225	225	A: No, not really. I spends a lot of time with our income tax, though. especially, this year and last year. Um, I have been married for just a few years, so I've had to really switch around from the EZ form to the, uh, B: Schedule A. A: Right. B: Well, yeah. A: All the deductions and all that. B: Did you notice that when they passed the new simplified tax act, it seemed like it made everything harder?	when they passed the new simplified tax act  it seemed like it made everything harder	entailment	225
232	232	B: Yeah. Those are pretty. A: Number one turned out just great, and the lady said she couldn't believe that they know that I had done it in the color that they had decorated the nursery	they know that she had done it in the colors that they had decorated the nursery	entailment	232
151	151	A: Well, presumably those who find out such information, if they are doing it, I would prefer to not to be known, and, I mean, you know, the classic, oh, I don't know C I  conspiracy theories or whatever, would have such parties trying to do it without your knowledge. So there's,, things that invade that second type of privacy where you do know about them and possibly things that invade that second type of privacy without you knowing about it, and I can't talk about the second one other than to generate paranoia. It's a surmise and, I'd like to think that it's quite low, at least in this country. B: to surmise. It is there. A: I don't think I'd like the KGB monitoring my phone or anything like that.	he would like the KGB monitoring his phone	contradiction	151
58	58	But he ended up eating it himself. I was reluctant to kiss my mother, afraid that somehow her weakness and unhappiness would infect me. Naturally I didn't think for a minute that my life and spirit could stimulate her.	her life and spirit could stimulate her mother	contradiction	58
20	20	Chopra stood unsteadily on his feet. The shapechanger bounded around with excitement. Chopra could tell something had happened.	something had happened	entailment	20
72	72	She rubbed them away with an angry fist. She was a fool to let anyone get round her. How long before she learned that folk 'll always take advantage of weakness?	folk 'll always take advantage of weakness	entailment	72
188	188	B: Right, you know, like In packaging A: Yeah. B: and, uh, you know, just goodness. A: Yeah, I don't think they do the packaging at this plant,	they do the packaging at this plant	contradiction	188
139	139	A: And, uh, I got to stay home with my kids, which I really wanted to do, but now I could not go back and do it. B: Yeah. A: I really couldn't, I don't think I could stay home all the time and do nothing.	he could stay home all the time and do nothing	contradiction	139
29	29	Jed wondered. He 'd scarcely set eyes on him since the night they 'd had dinner together at the house in Westwood. Nobody had mentioned him either and Jed didn't feel he should ask.	Jed should ask	contradiction	29
237	237	A: or you know, it doesn't seem that it's going to make much of a difference. B: Uh-huh. It, I mean, I don't know, I don't think George Bush will make the American people happy with ninety-seven cents a week.	George Bush will make American people happy with ninety-seven cents a week	contradiction	237
159	159	B: I think that not only applies inside the public school system, but in society itself. there's been too much negative reinforcement. How much, like, the caught being good slips. How about, just the John Q citizen out there on the street? A: Yeah, well that's true. I think, really though, I mean, that's one thing that, I mean, my kids definitely get spanked when they need to be spanked. But I really do try to use positive, uh, reinforcement with them at home, also. And it really helps. And I mean, they don't get spanked very often, but they do when they deserve it, you know. But, uh, I don't think any kid should be exempt from being spanked.	some kid should be exempt from being spanked	contradiction	159
6	6	Then the silence in the Zoo became complete. Woil stared around him and then suddenly with a push of his wings raised himself into the air, turned, and landed ten feet away on the back of a green bench. Creggan could see that he was afraid and that his fear was making him terribly uncertain.	Woil was afraid	entailment	6
105	105	L. Underneath, in purple ink, had been added. ``And love, Fenella'', with a capital X as a kiss. I might have known Lisabeth wouldn't have walked up the stairs herself to leave the note.	Lisabeth wouldn't have walked up the stairs herself to leave a note	entailment	105
132	132	B: That's true. A: So. B: Uh, the other argument is that the death penalty is a deterrent and I really don't, uh, agree with that. I don't think anyone who would commit uh, a crime that would get them the death penalty would stop at the moment and say, well, I was about to kill and dismember this person but, oh, if they catch me they're going to kill me so I better not do it. I just, don't think uh, that it works that way. A: Yeah.  I don't think it's done.	it's done	contradiction	132
164	164	B: All right, well. A: Um, short term, I don't think anything's going to be done about it or probably should be done about it.	something's going to be done about it	contradiction	164
87	87	Country churches were never locked. You could wander in at any time. Perhaps Cromwell when he passed also found the door of Coldingham Priory locked and decided that he would get in anyway even if it meant removing a whole wall in order to do so.	Cromwell would get in anyway	entailment	87
33	33	``I hope you are settling down and the cat is well.'' This was a lie. She did not hope the cat was well.	the cat was well	neutral	33
142	142	A: so it's nice to get away. It's just amazing, how much you miss. B: Yeah, it,  Yeah, it, yeah, it really is. I mean, I don't think I ever see the Little Dipper,	she has seen the Little Dipper	contradiction	142
212	212	B: So again, it never really penalizes, the company doing the wrong. A: Right. That will, B: They can go right on doing the same old thing they always used to. A: Huh. B: And if they know some practice is wrong, you know,	some practice is wrong	entailment	212
82	82	However, I will let the gynandrous renegade stay here under one condition. If Penumbra questions either of us, we will not lie. If she suspects Crevecoeur is here and asks we let him go back.	Crevecoeur is here	entailment	82
11	11	``Look, lady, give me a break. I just deliver the stuff, I don't interview it for the Sunday papers.'' He waved the paper at her and even at a distance she could see that it said very little.	the paper said very little	entailment	11
97	97	Matthew rode on feeling a little more at peace with himself. He skirted the spruce plantation and supposed that at some point he should tell Sara about it. He could imagine that she might be interested in its money-making propensity at the end of the year.	Sara might be interested in its money-making propensity at the end of the year	entailment	97
147	147	B: I wouldn't be surprised. A: You know, because they don't want to send them to daycare. B: I doubt if they would say it was too long.	it was too long	contradiction	147
178	178	A: Boy that's scary, isn't it. B: Oh, can you imagine, because it happens in the middle of the night, so you know, these parents didn't know the kid was gone until the kid is knocking on the door screaming, let me in.	the kid was gone	entailment	178
93	93	O listened. As he listened he could smell the man. And he could hear that the song was almost turning into a sob.	the song was almost turning into a sob	entailment	93
153	153	B: I mean, you can't guarantee that they wouldn't escape from prison and do it again. A: Right.  And then do it all over again.  Uh-huh. B: And I don't think that rehabilitation is effective.	rehabilitation is effective	contradiction	153
231	231	B: No, it was, I didn't like the way it ended. A: I know, well the only reason I know why it ended is on Arsenio Hall one night, Christopher Reeves told, that, you know, B: Uh-huh. A: I can't believe they killed them.	they killed them	entailment	231
122	122	A: Oh, oh yeah, and every time you see one hit on the side of the road you say is that my cat. B: Uh-huh. A: And you go crazy thinking it might be yours. B: Right, well I didn't realize my husband was such a sucker for animals until I brought one home one night.	her husband was such a sucker for animals	entailment	122
187	187	B: Uh, with regard uh, to jury trials. I really feel as though, uh, uh, whatever system has been used historically, in particular jurisdiction, you know, is really the only kinds of things that you can use. Because the jurisprudence is, you know, based uh, you know, on accumulated body of law. And if you have a situation where you change that body of law, then all of sudden they could start going back and digging up all these cases uh, that would be handled differently were they judged by today's standards. So I really don't think they can really do much of anything to change it.	they can really do something to change it	contradiction	187
31	31	Nora calculated that there must be lots of single men up there so she decided it was ideal for the ``manhunt'', as we called it, even though the train fare was a serious consideration. I remember we went up to Euston together one Saturday morning, very excited, to buy the ticket in advance. It was a secret - if my parents had known she was going away alone they would have soon put the kybosh on it.	Nora was going away alone	entailment	31
38	38	And what she had said, and went on saying quietly, calmly, efficiently, was that she loved Maggie. She paid attention. At eight Maggie had not known that her grandmother was famous but she had seen that people had something in their manner when they looked at Rachel.	Maggie's grandmother was famous	entailment	38
202	202	B: And as far as like them, uh, entertaining the rights that they should have. A: Uh-huh. B: I mean, we educate them, we feed them, we take care of them and they no sooner get out on the street and they're back in again. A: Uh-huh. B: I'm not saying they're all bad,	they're all bad	contradiction	202
54	54	Her priggishness. I admire it. I know she does wrong things she tries to organize other people's lives she can't see Mr Knightley is a man in a million.	Mr Knightley is a man in a million	entailment	54
73	73	At length she decided that there was nothing to be gained by worrying her. Probably there was some quite innocent explanation, which Roger Kenyon would give her when she returned the wallet - if, indeed, it were his. And yet why had his manner changed so abruptly when he learned that the girl whose hat he had rescued was going to live at Sunset Cottage?	the girl whose hat Roger Kenyon had rescued was going to live at Sunset Cottage	entailment	73
161	161	A: It's divided, yeah. B: Wow! A: It really is, so we've got our Cowboys here and, uh, I don't think anybody roots differently	somebody roots differently	contradiction	161
121	121	A: and then once they do get elected, they don't have the power or the authority or the willingness to do those things that they promised, you know, beforehand. B: Right. A: You know, maybe it just wasn't possible at all in the first place, you know, like the no new taxes thing. You know, that's, uh, with the economy going the way it is and everything, that was nearly ridiculous thing to, even try to do. B: Yeah.  Yeah. Well, I don't think he's going to have to worry about that next year.	he's going to have to worry about that next year	contradiction	121
228	228	B: so there's only been really one working. A: Uh-huh, same here. Uh-huh. B: And, uh, it works for me but I can't see that it would work for probably the majority of people.	it would work for probably the majority of people	contradiction	228
24	24	That is to say, I did not take sufficient account of the fact that at that time of the day, what Mr Farraday enjoys is a conversation of a lighthearted, humorous sort. Knowing this to be his likely mood when I brought in the tea yesterday afternoon, and being aware of his general propensity to talk with me in a bantering tone at such moments, it would certainly have been wiser not to have mentioned Miss Kenton at all. But you will perhaps understand that there was a natural tendency on my part in asking what was after all a generous favour from my employer to hint that there was a good professional motive behind my request.	there was a natural tendency on her part to hint that there was a good professional motive behind her request	entailment	24
193	193	A: but that is one of my solutions. Uh... B: I know here in Dallas that they have just instituted in the last couple of years, uh, a real long period of time that you can absentee vote before the elections. And I do not think they have seen a really high improvement.	they have seen a really high improvement	contradiction	193
116	116	Paula could not help herself. It was just the way she was. Others might say they hated her and mean it.	others hated Paula	entailment	116
71	71	``I wanted to tell you. But the Bookman asked me to keep our meeting a secret.'' How did you know I 'd met him?	he had met the Bookman	entailment	71
206	206	A: I do too. I believe about ten years ago that we went through a terrible time, but I don't, I believe that they're better now, you know, wh-, B: I think so. I don't think they're shoddy	they're shoddy	contradiction	206
66	66	Why should this topic matter? You talked about everything else as you usually do. Why should I feel Maelmuire is important?	Maelmuire is important	contradiction	66
110	110	``And you're wrong about us. We're not children and I 'd say we're learning the rules pretty quickly.'' You may have noticed I'm not shaking any more!	he's not shaking any more	entailment	110
173	173	A: Uh, well, it would depend on when you go it's not excessively crowded on the weekends. B: See I'd want to be there in the mornings like from nine thirty to ten thirty. A: Oh, I don't think that would be bad at all.	that would be bad	contradiction	173
114	114	The Deputy Under Secretary could talk of his host's prospects and disappointments, he could learn of the problems of digging out foreign exchange and hard currency in the Third World, the tribulations over the renewal of Residence Permits, the difficulties of keeping reliable servants, but of his own world he must remain silent. The Deputy Under Secretary headed the Secret Intelligence Service of the United Kingdom, and that was not a subject matter for gossip and conversation on a bougainvillaea-fringed veranda as the lights of the fishermen's dug-outs floated inside the coral reef... No bloody way. He was a man who could be honest with himself and in honesty he could say that he was both pleased and relieved to be back at his desk on a grey Monday morning in London.	the Deputy Under Secretary was both pleased and relieved to be back at his desk on a grey Monday morning in London	entailment	114
171	171	B: And, you know, the whole electronic classroom idea. I don't know if I I'm yeah, in favor of, yeah, A: I don't think that's going to work.	that is going to work	contradiction	171
126	126	A: Yeah, they did. They put a lot of pressure on him from the outside and from the inside. Uh, it's funny watching them play, he's probably like a lot of quarterbacks, uh, when the pressure is really on when it's down to the last few minutes of the game for the season is when the guys seem to really do their best. B: Uh-huh. A: And I haven't quite figured that out, if they figure they have got it won or if there's no real hurry because the first three quarters or, uh, uh, if something happens that that adrenalin starts flowing.	they have got it won	neutral	126
179	179	B: Oh, I see. A: um, and I think I'm getting a better caliber of student at the private school, because I think their parents pay more, and I think the kids are a little bit more challenged, because their parents are probably college educated, where at the public school, I don't think as many parents are college educated,	as many parents are college educated at the public school	contradiction	179
113	113	I spent just over an hour with Patterson which, I found out later, turned out to be another first. Time is money in the City and few people are worth an hour unless it's over lunch and only then if you're involved in a takeover bid. It was also I learned one of the few occasions anyone at PKB could remember that Patterson had a meeting with his door shut and nobody got fired.	Patterson had a meeting with his door shut and nobody got fired	entailment	113
