	Unnamed: 0	sentence_A	sentence_B	label	idx
136	136	B: Yeah, and the ground will filter some of it but not all of it. A: No, not when you figure, I didn't realize one cow produces that much manure	one cow produces that much manure	entailment	136
18	18	Jim waited. He waited a long time, and when the young doctor finally came out, it was almost dark. Jim could nonetheless tell by his anxious face that something was wrong.	something was wrong	entailment	18
34	34	Jane ate without pausing. Hunger was an unknown experience. She had never imagined it could actually hurt.	hunger could actually hurt	entailment	34
175	175	A: I spend a lot of time reading about these things. I'm quite interested. I find it very exciting for the coverage we have now, today. B: Yes and I think we do get pretty good coverage. I don't feel that the American people is being shortchanged by uh, the news coverage.	the American people are being shortchanged by the news coverage	contradiction	175
235	235	A: Highland Park's thinking about going that route. B: Uh-huh. A: So it, and then I think that's going to push teachers to dress a lot more professionally than they do. B: Yeah, I don't think a lot of teachers are very professional	a lot of teachers are very professional	contradiction	235
61	61	The big Norwegian shook his head, frowning. ``Jeg fonstAr ikke.'' I don't think he found Ward's accent at all easy and anyway like many foreigners he found it easier to speak English than to understand it.	the big Norwegian found Ward's accent at all easy	contradiction	61
172	172	B: Right. And they repacked the wheel bearings. A: and they repacked the the wheel bearings. Yeah but, uh, I've had considerable experience. you might say I'm, uh, uh, good back yard mechanic	she is a good back yard mechanic	entailment	172
245	245	GM confirmed it received U.S. antitrust clearance to boost its holding. Sansui Electric agreed to sell a 51% stake to Polly Peck of Britain for $110 million. Still, analysts said the accord doesn't suggest Japan is opening up to more foreign takeovers.	Japan is opening up to more foreign takeovers	contradiction	245
135	135	B: Yeah. How about Mister Rogers, is he still around? A: Yes. Yeah. They still show Mister Rogers. I don't think he's making new ones,	Mister Rogers is making new Mister Rogers	contradiction	135
81	81	At this time of year not much, it's been a dryish summer, and there's not a lot of water coming down. Say half a knot - and that's probably an over-estimate. If you say that a freely-floating body - and the weights would help a bit there because they'd keep it under water and out of any wind - moves down on the ebb at an average of a bit under two knots you'd not be far wrong.	a freely-floating body moves down on the ebb at an average of a bit under two knots	entailment	81
4	4	Some of them, like for instance the farm in Connecticut, are quite small. If I like a place I buy it. I guess you could say it's a hobby.	buying places is a hobby	entailment	4
76	76	``Clever''. Klug means ``clever''. Would you say that Abie was clever?	Abie was clever	neutral	76
169	169	A: And now it's election time again so they're trying to lower them. B: Oh. A: So they're just talk about lowering them but they never do, they just keep raising them. B: I've never seen taxes really go down.	taxes would really go down	contradiction	169
247	247	Richard Breeden had n't noticed that his new desk had just four telephone lines and one phone .	Richard Breeden's new desk had just four telephone lines and one phone	entailment	247
57	57	He pulled occasionally, his arms tiring. Conker slowed a little, but the branches were coming too fast, he had to lean right forward and couldn't use his hands. He remembered the gate at the end of the track had time to hope it was open because he didn't think Conker could jump it.	Conker could jump the gate	contradiction	57
14	14	And why bother to write anyway? What was there to say? Mary had some vague idea that Adam's parents might suspect he was down here and come to see him.	Adam was down here	entailment	14
243	243	The South Korean government is signing a protocol today establishing formal diplomatic relations with Poland. The two are also signing a trade agreement. South Korean government officials said they don't expect that Seoul can loan money to Warsaw, but it can ``offer experience.''	Seoul can loan money to Warsaw	contradiction	243
95	95	That evening Shannon steered well clear of Dane, all but tiptoeing around him, determined not to land in any more confrontations. From now till this snow siege ended, she would simply live under the same roof, but keep to her own side of an invisible barrier, she decided. She could only hope he 'd do the same.	Dane would do the same	neutral	95
246	246	So who knows? In a generation or two some of the New Crowd may attain true respectability, perhaps to be displaced in turn by a later flock of unscrupulous raptors. Or perhaps Wall Street, when it has suffered enough, will realize that finance is a service industry, and change its ethos.	finance is a service industry	entailment	246
224	224	A: Yeah. The radio doesn't really have much news sometimes. The stations I listen to are just mainly music. B: Yeah, I think you pretty much have to listen to all news station to get any news at all. A: Yeah. Do you think that TV is, uh, pretty accurate.	TV is pretty accurate	neutral	224
220	220	A: So, we're comparable. B: Yeah. A: As a matter of fact, I just paid my Richardson taxes because I live in Richardson and supplemented the Robin Hoods very thoroughly, I think. B: Yeah, I think Yeah, we have got it on the line, don't we.	they have got it on the line	entailment	220
156	156	A: That's fairly interesting. B: I bet that would be, rather interesting. Uh, that's, uh, self improvement, well, that's kind of a hobby but it is self improvement from the standpoint of probably relaxing, uh. A: Yeah, I don't know that I read anything strictly labeled self improvement.	she reads anything strictly labeled self improvement	contradiction	156
117	117	A: How do you feel about gun control? B: Well, uh, I mean I don't think that guns should be outlawed	guns should be outlawed	contradiction	117
140	140	A:  nanny, sort of? Uh-huh. Uh-huh. B: and you know, I could envision a society where that would happen and make an interesting, uh, uh, story or whatever. A: Yeah. B: I don't think I have a philosophical problem with that.	she has a philosophical problem with that	contradiction	140
198	198	B: Uh, I have, uh, I guess a lot of thoughts about the Vietnam War, um, I guess I feel like I was pretty young while it was going on and so there's probably a lot of things I remember and a lot of things that I really didn't have a clue as to what was happening. B: Yeah. A: Um, looking back, like maybe some of the things that I know now, I'm not sure I do believe it was worth the cost in dollars and lives. That was one of the questions that she asked us to think about, because we never went to war. I don't think we were committed to winning it and getting out	they were committed to winning the Vietnam War and getting out	contradiction	198
239	239	B: And the tanks came in and, you know, pretty much took care of that. A: Exactly. B: And, A: Yeah, uh, that, personally I don't see as Gorbachev as being maybe a threat, and I think he's actually, honestly trying to do some change. B: Uh-huh. A: But I don't believe that he, in this first pass around, you know, being the first one to really turn things around or attempt to is going to be allowed to get away with it either.	Gorbachev is going to be allowed to get away with doing some change	contradiction	239
65	65	If there are spirits at work at the time, they come only from yourself, not from the fume of the incense. Why should spirits aid living beings? What arrogance is it that drives people to believe they can have power over them?	people can have power over spirits	contradiction	65
0	0	It was a complex language. Not written down but handed down. One might say it was peeled down.	the language was peeled down	entailment	0
118	118	B: I don't know how my parents did it. A: Yeah. B: I mean, there were five of us and I don't recall, you know, wanting anything in particular. Uh, but I don't know how my father did it. He worked at a truck line and he just didn't make that kind of money with five children. But we did okay. We had a house and a home and, but now, my wife and I both work and I don't believe we have as much as my parents did.	he and his wife have as much as his parents did	contradiction	118
138	138	B: but if they get the little tiny kids saving it now, in five years, when they get bigger, it'll work a little bit more, too. A: Yeah.  True. B: Because it's, we've all got to do it right now. I just, I really amazed to find out that, eighty per cent are filled now, in garbage fills. In five years we're supposed to be at max. A: Uh-huh. B: I don't think I can keep my own garbage.	she can keep her own garbage	contradiction	138
120	120	B: boy, he's a big one. A: he's pretty big. That's why it really surprises me, you know, that he hasn't come back, because, like I said, he's never gone away like this before, and, I would think, you know, I mean, he might could get hurt by a car or something. I don't know that he could really get killed that easily because he is so big.	he could really get killed that easily	contradiction	120
84	84	Nicky approached her with the assumption that men are naturally right and it is the role of women to follow their lead. Constance, whose confidence was growing daily, was not prepared to give in to Nicky's wishes merely because of his sex. If she felt he was right then she agreed with him.	Nicky was right	neutral	84
210	210	B: All right, well. A: Um, short term, I don't think anything's going to be done about it or probably should be done about it. B: Right.  Uh, are you saying you don't think anything should be done in the short term?	anything should be done in the short term	neutral	210
55	55	Only she herself knew the evil thoughts she had and how effortlessly they could be translated into action. ``I 'll make a cup of tea.'' No she would not tell Peter that the person he loved most in the world was dead.	the person Peter loved most in the world was dead	entailment	55
90	90	Joseph spat and spluttered blood. He had lost the two centre top teeth and with the tip of his tongue he could feel that the two on either side were also loose.	the two teeth on either side were also loose	entailment	90
64	64	She swallowed hard, unsure if she had the nerve to go ahead. The memory of the pain in Tara's eyes last night decided her. Did he really expect her to believe that Tara was only the housekeeper?	Tara was only the housekeeper	contradiction	64
63	63	It's where the bands practise. I can't remember what band Petra's in, but I seen them practise once. They were OK but I didn't think they was brilliant.	Petra's band was brilliant	contradiction	63
109	109	And I was excited by my new importance. Proud and pleased to be playing opposite Frank Donovan who had once stood in for Hayden Coffin. Occasionally perhaps I should notice that he was not the jovial easy-going character I remembered from my humble place in the chorus.	Frank Donovan was not the jovial easy-going character she remembered	entailment	109
17	17	She might have sat all afternoon, nibbling and stuporous, exhausted but not sleepy. But the glazier finally came down from the upper floor, cheerfully announcing that all was now right and tight and he would be on his way. Maggie could tell that he would have liked to stop for a chat that he felt sorry for her left on her own but she lacked either her grandmother's grace or her mother's energy so she did not offer him tea.	the glazier would have liked to stop for a chat	entailment	17
203	203	A: Yeah, you're probably right, two years might be a little too long. B: Yeah, and there will be a lot of rebellion in that and when you get people who have no desire to be there in the first place, I don't think that they're going to be serving anybody.	they're going to be serving somebody	contradiction	203
30	30	Yet what good came from knowing that a woman had killed herself? The children who had suffered a trauma would survive the experience, scarred by it and a little flawed by it. They would never forget that for a week they had imagined the act of murder had been committed.	for a week the children had imagined the act of murder had been committed	entailment	30
234	234	B: I do not know. I wonder where he gets it? You know, you must, I think TV is bad. Because they, uh, show all sorts of violence on, A: That and I do not think a lot of parents, I mean, I do not know how it is in the Air Force base. But, uh, I just do not think a lot of people, because of the economy, both need to work, you know. I just do not think a lot of parents are that involved any more.	a lot of parents are that involved	contradiction	234
165	165	A: Oh, yes. Animals have a way of talking. B: Alfie did. I tell you if I could have gotten a hold of that cat that day. A: I don't know uh, that I'd trade my dog in for the world.	he would trade his dog in for the world	contradiction	165
26	26	I should dearly have liked to know whether they were Europeans or Americans, but I couldn't hear the accents. They appeared to be arguing. I hoped the white men weren't telling him to eliminate all witnesses because I don't believe it would have needed much persuasion.	eliminating all witnesses would have needed much persuasion	contradiction	26
19	19	``Yes?'' ``Nathan?'' He could tell it was long-distance the line was so gravelly and hollow but he didn't recognise the voice.	the call was long-distance	entailment	19
100	100	Gloria remarked as they shared their coffee break in the kitchen. Melissa suppressed a sigh. She had hoped to dodge the subject but might have known that Gloria's boundless interest in all things morbid and sensational would make it impossible.	Gloria's boundless interest in all things morbid and sensational would make dodging the subject impossible	entailment	100
130	130	A: and if they weren't spending all the money on drug testing, people could have got a raise. So, see, you know, there's different, I think that's more of a personal view of mine other than a yes, sir, we should have drug testing because there's really a problem B: Uh-huh. A: and I know that. But then, I have other views to it. B: I didn't think it was that expensive because my son was in probably a week and a half period	it was that expensive	contradiction	130
67	67	It is all very well, in these changing times, to adapt one's work to take in duties not traditionally within one's realm. But bantering is of another dimension altogether. For one thing how would one know for sure that at any given moment a response of the bantering sort is truly what is expected?	at any given moment a response of the bantering sort is truly what is expected	neutral	67
125	125	B: And I've worked in the hospital for fifteen years and I've taken care of a few AIDS patients. A: Uh-huh. B: Uh, when they asked us did we want to, uh, keep it the same or, uh, spend more, spend less, uh, I think right now what they're spending is adequate. Uh, for my personal opinion. Uh, because I think it's something that's going to take them a while to come up with a, uh, vaccine for. A: Yeah.  Uh-huh.  Uh-huh. B: I don't think it's going to be that easy to come up with	it is going to be that easy to come up with	contradiction	125
98	98	``That's good.'' Ruth stood looking at her. Rachaela could imagine Emma would have been all congratulations and the joys of womanhood.	Emma would have been all congratulations and the joys of womanhood	entailment	98
5	5	Look, my dear, I'm not in my dotage yet, and I know I'm a grumbler and a complainer. You could say the only form of comfort I 've got are my complaints.	the only form of comfort he has are his complaints	entailment	5
145	145	B: Now see I. A: I'm intrigued by it, but I'm not sure I want to go see it yet. B: Yeah, I don't think I want to see that either.	she wants to see that	contradiction	145
207	207	B: you know, sometimes I would go over, but you know, it wouldn't hit me in a big way because I knew that, uh, I would have it covered in that respect. A: Right.  Right. That's good. I don't think we've gone that far, to pay it you know, in advance before we spend it,	they've gone that far	contradiction	207
248	248	The city's Campaign Finance Board has refused to pay Mr. Dinkins $95,142 in matching funds because his campaign records are incomplete.  The campaign has blamed these reporting problems on computer errors. And, says Mr. Dinkins, he didn't know the man his campaign paid for a get-out-the-vote effort had been convicted of kidnapping.	the man Mr. Dinkins' campaign paid for a get-out-the-vote effort had been convicted of kidnapping	entailment	248
8	8	Like now. The Community in Knockglen would defend Eve vociferously. Even some of the Sisters here in Dublin might see that the girl had a point.	the girl had a point	entailment	8
89	89	``Molly likes having an audience for her tales and it passes the hours for them.'' When Miss Louisa had a second more severe stroke at the end of August, and Miss Ellen another heart attack, both old ladies died within a few days of each other. Their friends could only feel that death was merciful in the circumstances especially with war imminent and that Molly had made the closing months of their lives very happy.	death was merciful in the circumstances	entailment	89
106	106	He 'd gone. Philip had to get them back. His Dad would kill him if he found that he 'd taken them.	Philip had taken them	entailment	106
150	150	A: Big time there, sure is. B: It surely is. A: I don't think I'd go to work without a bulletproof vest on myself.	he would go to work without a bulletproof vest	contradiction	150
195	195	B: I look at our big green containers, and I say, well, they work fine and I keep mine outside the garage so that I don't have any odors but it's clearly a place where, uh, uh, A: Oh, right. B: it will be interesting to see how well that works and I'm glad the community is doing it. Uh, it's one of those things that kind of has to be forced on people. Uh, I don't know what you saw back, uh, years ago, but for me the thing that strikes me is uh, growing up in rural South Dakota where, hey the farmers brought their eggs to town and the local hatchery would candle them and package them is that, uh, in the fifties, uh, you could say we had the recycling going on then that we should have now. Which was all the milk bottles were glass	they had the recycling going on then that they should have now	entailment	195
215	215	A: I thought Carter was good too, and that was, yeah, B: Did you? I always liked him, I thought he was great at the time and I just couldn't get over the fact that Reagan beat him. you know, that I just couldn't believe that he got voted out.	Carter got voted out	entailment	215
196	196	B: And they go down the line ten years and then on some little technicality they get out and on the streets again doing the same they did before. A: Uh-huh. B: And, you know, that's about the only thing. Like for theft and stuff like that or manslaughter, you know, I don't think they should do that.	they should do that	contradiction	196
115	115	I WAS really only a bystander in the tragedy of young Mr and Mrs McLeod. It was not really my business although it could be said that I had known them both - had seen them about - for most of their lives.	she had known Mr. and Mrs. McLeod for most of their lives	entailment	115
249	249	Under the Racketeer Influenced and Corrupt Organizations law, or RICO, the government has the authority to seek to freeze or seize a defendant's assets before trial.  According to individuals familiar with Mr. Antar's case, prosecutors issued their warning this week after one of Mr. Antar's attorneys asked whether legal fees might be subject to seizure. In a letter, prosecutors told Mr. Antar's lawyers that because of the recent Supreme Court rulings, they could expect that any fees collected from Mr. Antar may be seized.	any fees collected from Mr. Antar may be seized	entailment	249
15	15	``And you're not having this dress,'' Nora said, bending down to look at the price tag. ``It's two and a half guineas!'' she hissed at Louise who could tell that she was genuinely appalled.	Nora was genuinely appalled	entailment	15
148	148	A: But, uh, uh, I don't understand, I guess, why the schools seem to have such a high dropout rate in the big cities. B: Uh, well, I don't pretend to understand that either. Uh, but I'm not quite sure that it's the kind of thing that ought to be blamed on the schools. But then, again, I'm not quite sure where the blame ought to be put. Uh, because the dropout rate is, in those areas, w-, it's high in those areas where also there's poverty and crime. And they all seem to go together. And it seems like if you could eliminate one of the parts of that circle, where you have the dropout rate and crime and, you know, general poverty kind of conditions, that things ought to get better. So, uh, the other two a-, they're all three social issues and could be addressed by the government in any ways. And clearly, to me, is a kind of government thing to fix but it's just like, I don't expect them to know which part is best to fix just like I don't know. it's a complicated issue. I still don't think I would blame it directly on the school.	he would blame it directly on the school	contradiction	148
127	127	A: Uh, well then you must know a lot more about this than I do. B: Uh, I think, uh, the system right now, you know, you know, is fine. I think it should be by a jury. I don't think the judge should have, I mean he's just there kind of like the referee. A: Uh-huh, Uh-huh. B: Uh, I don't even think that it should be unanimous either. Uh,	it should be unanimous	contradiction	127
43	43	``Oh, my poor Folly... We 've been together for five years, Lexy and I - she practically holds that company together. Of course I gave her an ``A''. But that doesn't mean I'm having an affair with her.	he is having an affair with Lexy	contradiction	43
74	74	Anna looked at Peter again and said to herself in a guilty whisper, ``Will he become even more difficult?'' She wondered if a stranger could tell that he was difficult, just by looking at him. Would such a person watching Peter now reading the prayers of Rite B in his level pleasant voice notice that resentment lay like his blood just under his skin because the life he had chosen had not turned out as he had expected it to?	resentment lay just under Peter's skin	entailment	74
85	85	Your honesty shines out of your face, my darling. It isn't your fault that cynical men like myself won't let themselves believe what they see! I just wish you could believe that Eddie's death was an accident and nothing to do with me.	Eddie's death was an accident and nothing to do with him	entailment	85
3	3	Part of it was to be compulsorily purchased. You could say that Gustave was shepherded into creative retreat at Croisset by epilepsy. You could also say he was driven there by the railway.	Gustave was driven to creative retreat in Croisset by the railway	entailment	3
149	149	B: She says that when her husband died oh, that my uncle had said that he would never put her in a rest home. So it's kind of, uh, I don't know. I mean, I don't think my parents would but she is getting pretty bad like she has to have like a little toilet right by her bed and, it's, A: Uh-huh. B: and my mom has to take care of her pretty much so it gets, I don't know. it's a hard decision, but I don't think I would do it to my parents personally.	she would do it to her parents	contradiction	149
205	205	B: So, let's talk about the, uh, wonderful abuses in the State of Pennsylvania of personal property taxes whereby you can purchase something mail order and after the fact, the State of Pennsylvania can find out about it and send you a bill for the sales tax appropriate to that item that you purchased as well as interest and penalties from the time that you bought it. What do you think? Is Pennsylvania kind of out of line there? A: Well, actually, I do n't think they're out of line.	they're out of line	contradiction	205
56	56	``It's not your day, is it, dear?'' ``No, but they 've got to be done, and Shirley's making the tea.'' Ianthe had not told her mother that she sometimes had to dust the books in the library.	Ianthe sometimes had to dust the books in the library	entailment	56
131	131	B: I did, too. A: I mean, it was just more for my money. B: Yeah. I didn't think it was too long at all.	it was too long	contradiction	131
162	162	B: if you get it on sale, A: Yeah, yeah, so we bought that or we bought the filets, and then the chicken, or turkey nuggets, and I don't think anybody in my house knows the difference, unless you tell them.	someone in his house knows the difference	contradiction	162
217	217	A: Uh, I saw Seven Eleven that was hiring. B: Well, I'm sure with the new, uh, contract awarding I think it went to Lockheed, didn't it?	the contract went to Lockheed	entailment	217
21	21	It seemed impossible that anyone could endure such pain for so long, but at last the doors of the Renault slammed and there was comparative silence. The engine was started up, revving violently as the car was turned round on the narrow road. John could tell that it was being driven back up the hill towards Putna.	the car was being driven back up the hill towards Putna	entailment	21
52	52	His hair was white, as my daughters reported when they went to view the body before it was given to the Odonata. Now he is known as The Man Who Changed the World, and there are statues to him everywhere. No one remembers he had a younger brother.	The Man Who Changed the World had a younger brother	entailment	52
